poscomy.top,Gname.com Pte. Ltd.,complaint@gname.com,www.gname.com,a.share-dns.com|b.share-dns.net|,2024-11-11T04:27:24Z,2024-11-11T04:28:03Z,2025-11-11T04:27:24Z,2024-11-11 04:27:24 UTC,2024-11-11 04:28:03 UTC,2025-11-11 04:27:24 UTC,clientTransferProhibited,"Domain Name: poscomy.top|Registry Domain ID: D20241111G10001G_34044700-top|Registrar WHOIS Server: www.gname.com|Registrar URL: http://www.gname.com|Updated Date: 2024-11-11T04:28:03Z|Creation Date: 2024-11-11T04:27:24Z|Registry Expiry Date: 2025-11-11T04:27:24Z|Registrar: Gname.com Pte. Ltd.|Registrar IANA ID: 1923|Registrar Abuse Contact Email: complaint@gname.com|Registrar Abuse Contact Phone: +65.6531989391|Domain Status: clientTransferProhibited https://icann.org/epp#clientTransferProhibited|Registry Registrant ID: REDACTED FOR PRIVACY|Registrant Name: REDACTED FOR PRIVACY|Registrant Organization: REDACTED FOR PRIVACY|Registrant Street:  REDACTED FOR PRIVACY|Registrant City: REDACTED FOR PRIVACY|Registrant State/Province: REDACTED FOR PRIVACY|Registrant Postal Code: REDACTED FOR PRIVACY|Registrant Country: REDACTED FOR PRIVACY|Registrant Phone: REDACTED FOR PRIVACY|Registrant Phone Ext: REDACTED FOR PRIVACY|Registrant Fax: REDACTED FOR PRIVACY|Registrant Fax Ext: REDACTED FOR PRIVACY|Registrant Email: Please query the RDDS service of the Registrar of Record  identified in this output for information on how to contact the Registrant, Admin, or Tech contact of the queried domain name.|Registry Admin ID: REDACTED FOR PRIVACY|Admin Name: REDACTED FOR PRIVACY|Admin Organization: REDACTED FOR PRIVACY|Admin Street:  REDACTED FOR PRIVACY|Admin City: REDACTED FOR PRIVACY|Admin State/Province: REDACTED FOR PRIVACY|Admin Postal Code: REDACTED FOR PRIVACY|Admin Country: REDACTED FOR PRIVACY|Admin Phone: REDACTED FOR PRIVACY|Admin Phone Ext: REDACTED FOR PRIVACY|Admin Fax: REDACTED FOR PRIVACY|Admin Fax Ext: REDACTED FOR PRIVACY|Admin Email: Please query the RDDS service of the Registrar of Record  identified in this output for information on how to contact the Registrant, Admin, or Tech contact of the queried domain name.|Registry Tech ID: REDACTED FOR PRIVACY|Tech Name: REDACTED FOR PRIVACY|Tech Organization: REDACTED FOR PRIVACY|Tech Street:  REDACTED FOR PRIVACY|Tech City: REDACTED FOR PRIVACY|Tech State/Province: REDACTED FOR PRIVACY|Tech Postal Code: REDACTED FOR PRIVACY|Tech Country: REDACTED FOR PRIVACY|Tech Phone: REDACTED FOR PRIVACY|Tech Phone Ext: REDACTED FOR PRIVACY|Tech Fax: REDACTED FOR PRIVACY|Tech Fax Ext: REDACTED FOR PRIVACY|Tech Email: Please query the RDDS service of the Registrar of Record  identified in this output for information on how to contact the Registrant, Admin, or Tech contact of the queried domain name.|Name Server: a.share-dns.com|Name Server: b.share-dns.net|DNSSEC: unsigned|URL of the ICANN Whois Inaccuracy Complaint Form: https://www.icann.org/wicf/|>>> Last update of WHOIS database: 2025-01-03T12:51:14Z <<<||For more information on Whois status codes, please visit https://icann.org/epp||NOTICE: The expiration date displayed in this record is the date the|registrar's sponsorship of the domain name registration in the registry is|currently set to expire. This date does not necessarily reflect the expiration|date of the domain name registrant's agreement with the sponsoring|registrar.  Users may consult the sponsoring registrar's Whois database to|view the registrar's reported date of expiration for this registration.||TERMS OF USE: The information in the Whois database is collected through ICANN-accredited registrars. Jiangsu bangning science & technology Co., Ltd(BANGNING)make this information available to you and do not guarantee its accuracy or completeness. By submitting a whois query, you agree to abide by the following terms of use: you agree that you may use this data only for lawful purposes and that under no circumstances will you use this data to:  (1) to allow enable or otherwise support the transmission of mass unsolicited commercial advertising or solicitations via direct mail electronic mail or by telephone; (2) in contravention of any applicable data and privacy protection acts; or (3) to enable high volume automated electronic processes that apply to BANGNING (or its computer systems). Compilation repackaging dissemination or other use of the WHOIS database in its entirety or of a substantial portion thereof is not allowed without BANGNING prior written permission. You agree not to use electronic processes that are automated and high-volume to access or query the whois database except as reasonably necessary to register domain names or modify existing registrations. BANGNING reserves the right to restrict your access to the whois database in its sole discretion to ensure operational stability.  BANGNING may restrict or terminate your access to the whois database for failure to abide by these terms of use. BANGNING reserves the right to modify these terms at any time without prior or subsequent notification of any kind.",,1923,,REDACTED FOR PRIVACY,REDACTED FOR PRIVACY,REDACTED FOR PRIVACY,,,,REDACTED FOR PRIVACY,REDACTED FOR PRIVACY,REDACTED FOR PRIVACY,REDACTED FOR PRIVACY,,REDACTED FOR PRIVACY,,REDACTED FOR PRIVACY,"Registrant Name: REDACTED FOR PRIVACY|Registrant Organization: REDACTED FOR PRIVACY|Registrant Street:  REDACTED FOR PRIVACY|Registrant City: REDACTED FOR PRIVACY|Registrant State/Province: REDACTED FOR PRIVACY|Registrant Postal Code: REDACTED FOR PRIVACY|Registrant Country: REDACTED FOR PRIVACY|Registrant Phone: REDACTED FOR PRIVACY|Registrant Phone Ext: REDACTED FOR PRIVACY|Registrant Fax: REDACTED FOR PRIVACY|Registrant Fax Ext: REDACTED FOR PRIVACY|Registrant Email: Please query the RDDS service of the Registrar of Record  identified in this output for information on how to contact the Registrant, Admin, or Tech contact of the queried domain name.",,REDACTED FOR PRIVACY,REDACTED FOR PRIVACY,REDACTED FOR PRIVACY,,,,REDACTED FOR PRIVACY,REDACTED FOR PRIVACY,REDACTED FOR PRIVACY,REDACTED FOR PRIVACY,,REDACTED FOR PRIVACY,,REDACTED FOR PRIVACY,"Admin Name: REDACTED FOR PRIVACY|Admin Organization: REDACTED FOR PRIVACY|Admin Street:  REDACTED FOR PRIVACY|Admin City: REDACTED FOR PRIVACY|Admin State/Province: REDACTED FOR PRIVACY|Admin Postal Code: REDACTED FOR PRIVACY|Admin Country: REDACTED FOR PRIVACY|Admin Phone: REDACTED FOR PRIVACY|Admin Phone Ext: REDACTED FOR PRIVACY|Admin Fax: REDACTED FOR PRIVACY|Admin Fax Ext: REDACTED FOR PRIVACY|Admin Email: Please query the RDDS service of the Registrar of Record  identified in this output for information on how to contact the Registrant, Admin, or Tech contact of the queried domain name.",,,,,,,,,,,,,,,,,,REDACTED FOR PRIVACY,REDACTED FOR PRIVACY,REDACTED FOR PRIVACY,,,,REDACTED FOR PRIVACY,REDACTED FOR PRIVACY,REDACTED FOR PRIVACY,REDACTED FOR PRIVACY,,REDACTED FOR PRIVACY,,REDACTED FOR PRIVACY,"Tech Name: REDACTED FOR PRIVACY|Tech Organization: REDACTED FOR PRIVACY|Tech Street:  REDACTED FOR PRIVACY|Tech City: REDACTED FOR PRIVACY|Tech State/Province: REDACTED FOR PRIVACY|Tech Postal Code: REDACTED FOR PRIVACY|Tech Country: REDACTED FOR PRIVACY|Tech Phone: REDACTED FOR PRIVACY|Tech Phone Ext: REDACTED FOR PRIVACY|Tech Fax: REDACTED FOR PRIVACY|Tech Fax Ext: REDACTED FOR PRIVACY|Tech Email: Please query the RDDS service of the Registrar of Record  identified in this output for information on how to contact the Registrant, Admin, or Tech contact of the queried domain name.",,,,,,,,,,,,,,,,,MASKED_WHOIS_DATA
posehomeexpressdelivery-my.top,"NameSilo, LLC",abuse@namesilo.com,whois.namesilo.com,ns3.dnsowl.com|ns1.dnsowl.com|ns2.dnsowl.com|,2024-02-26T02:07:43Z,2024-03-22T22:46:47Z,2025-02-26T02:07:43Z,2024-02-26 02:07:43 UTC,2024-03-22 22:46:47 UTC,2025-02-26 02:07:43 UTC,clientTransferProhibited clientHold,"Domain Name: posehomeexpressdelivery-my.top|Registry Domain ID: D20240226G10001G_18562980-top|Registrar WHOIS Server: whois.namesilo.com|Registrar URL: https://www.namesilo.com|Updated Date: 2024-03-22T22:46:47Z|Creation Date: 2024-02-26T02:07:43Z|Registry Expiry Date: 2025-02-26T02:07:43Z|Registrar: NameSilo,LLC|Registrar IANA ID: 1479|Registrar Abuse Contact Email: abuse@namesilo.com|Registrar Abuse Contact Phone: +1.4805240066|Domain Status: clientTransferProhibited https://icann.org/epp#clientTransferProhibited|Domain Status: clientHold https://icann.org/epp#clientHold|Registry Registrant ID: REDACTED FOR PRIVACY|Registrant Name: REDACTED FOR PRIVACY|Registrant Organization: REDACTED FOR PRIVACY|Registrant Street:  REDACTED FOR PRIVACY|Registrant City: REDACTED FOR PRIVACY|Registrant State/Province: REDACTED FOR PRIVACY|Registrant Postal Code: REDACTED FOR PRIVACY|Registrant Country: REDACTED FOR PRIVACY|Registrant Phone: REDACTED FOR PRIVACY|Registrant Phone Ext: REDACTED FOR PRIVACY|Registrant Fax: REDACTED FOR PRIVACY|Registrant Fax Ext: REDACTED FOR PRIVACY|Registrant Email: Please query the RDDS service of the Registrar of Record  identified in this output for information on how to contact the Registrant, Admin, or Tech contact of the queried domain name.|Registry Admin ID: REDACTED FOR PRIVACY|Admin Name: REDACTED FOR PRIVACY|Admin Organization: REDACTED FOR PRIVACY|Admin Street:  REDACTED FOR PRIVACY|Admin City: REDACTED FOR PRIVACY|Admin State/Province: REDACTED FOR PRIVACY|Admin Postal Code: REDACTED FOR PRIVACY|Admin Country: REDACTED FOR PRIVACY|Admin Phone: REDACTED FOR PRIVACY|Admin Phone Ext: REDACTED FOR PRIVACY|Admin Fax: REDACTED FOR PRIVACY|Admin Fax Ext: REDACTED FOR PRIVACY|Admin Email: Please query the RDDS service of the Registrar of Record  identified in this output for information on how to contact the Registrant, Admin, or Tech contact of the queried domain name.|Registry Tech ID: REDACTED FOR PRIVACY|Tech Name: REDACTED FOR PRIVACY|Tech Organization: REDACTED FOR PRIVACY|Tech Street:  REDACTED FOR PRIVACY|Tech City: REDACTED FOR PRIVACY|Tech State/Province: REDACTED FOR PRIVACY|Tech Postal Code: REDACTED FOR PRIVACY|Tech Country: REDACTED FOR PRIVACY|Tech Phone: REDACTED FOR PRIVACY|Tech Phone Ext: REDACTED FOR PRIVACY|Tech Fax: REDACTED FOR PRIVACY|Tech Fax Ext: REDACTED FOR PRIVACY|Tech Email: Please query the RDDS service of the Registrar of Record  identified in this output for information on how to contact the Registrant, Admin, or Tech contact of the queried domain name.|Name Server: ns3.dnsowl.com|Name Server: ns1.dnsowl.com|Name Server: ns2.dnsowl.com|DNSSEC: unsigned|URL of the ICANN Whois Inaccuracy Complaint Form: https://www.icann.org/wicf/|>>> Last update of WHOIS database: 2025-01-03T12:47:23Z <<<||For more information on Whois status codes, please visit https://icann.org/epp||NOTICE: The expiration date displayed in this record is the date the|registrar's sponsorship of the domain name registration in the registry is|currently set to expire. This date does not necessarily reflect the expiration|date of the domain name registrant's agreement with the sponsoring|registrar.  Users may consult the sponsoring registrar's Whois database to|view the registrar's reported date of expiration for this registration.||TERMS OF USE: The information in the Whois database is collected through ICANN-accredited registrars. Jiangsu bangning science & technology Co., Ltd(BANGNING)make this information available to you and do not guarantee its accuracy or completeness. By submitting a whois query, you agree to abide by the following terms of use: you agree that you may use this data only for lawful purposes and that under no circumstances will you use this data to:  (1) to allow enable or otherwise support the transmission of mass unsolicited commercial advertising or solicitations via direct mail electronic mail or by telephone; (2) in contravention of any applicable data and privacy protection acts; or (3) to enable high volume automated electronic processes that apply to BANGNING (or its computer systems). Compilation repackaging dissemination or other use of the WHOIS database in its entirety or of a substantial portion thereof is not allowed without BANGNING prior written permission. You agree not to use electronic processes that are automated and high-volume to access or query the whois database except as reasonably necessary to register domain names or modify existing registrations. BANGNING reserves the right to restrict your access to the whois database in its sole discretion to ensure operational stability.  BANGNING may restrict or terminate your access to the whois database for failure to abide by these terms of use. BANGNING reserves the right to modify these terms at any time without prior or subsequent notification of any kind.",,1479,,REDACTED FOR PRIVACY,REDACTED FOR PRIVACY,REDACTED FOR PRIVACY,,,,REDACTED FOR PRIVACY,REDACTED FOR PRIVACY,REDACTED FOR PRIVACY,REDACTED FOR PRIVACY,,REDACTED FOR PRIVACY,,REDACTED FOR PRIVACY,"Registrant Name: REDACTED FOR PRIVACY|Registrant Organization: REDACTED FOR PRIVACY|Registrant Street:  REDACTED FOR PRIVACY|Registrant City: REDACTED FOR PRIVACY|Registrant State/Province: REDACTED FOR PRIVACY|Registrant Postal Code: REDACTED FOR PRIVACY|Registrant Country: REDACTED FOR PRIVACY|Registrant Phone: REDACTED FOR PRIVACY|Registrant Phone Ext: REDACTED FOR PRIVACY|Registrant Fax: REDACTED FOR PRIVACY|Registrant Fax Ext: REDACTED FOR PRIVACY|Registrant Email: Please query the RDDS service of the Registrar of Record  identified in this output for information on how to contact the Registrant, Admin, or Tech contact of the queried domain name.",,REDACTED FOR PRIVACY,REDACTED FOR PRIVACY,REDACTED FOR PRIVACY,,,,REDACTED FOR PRIVACY,REDACTED FOR PRIVACY,REDACTED FOR PRIVACY,REDACTED FOR PRIVACY,,REDACTED FOR PRIVACY,,REDACTED FOR PRIVACY,"Admin Name: REDACTED FOR PRIVACY|Admin Organization: REDACTED FOR PRIVACY|Admin Street:  REDACTED FOR PRIVACY|Admin City: REDACTED FOR PRIVACY|Admin State/Province: REDACTED FOR PRIVACY|Admin Postal Code: REDACTED FOR PRIVACY|Admin Country: REDACTED FOR PRIVACY|Admin Phone: REDACTED FOR PRIVACY|Admin Phone Ext: REDACTED FOR PRIVACY|Admin Fax: REDACTED FOR PRIVACY|Admin Fax Ext: REDACTED FOR PRIVACY|Admin Email: Please query the RDDS service of the Registrar of Record  identified in this output for information on how to contact the Registrant, Admin, or Tech contact of the queried domain name.",,,,,,,,,,,,,,,,,,REDACTED FOR PRIVACY,REDACTED FOR PRIVACY,REDACTED FOR PRIVACY,,,,REDACTED FOR PRIVACY,REDACTED FOR PRIVACY,REDACTED FOR PRIVACY,REDACTED FOR PRIVACY,,REDACTED FOR PRIVACY,,REDACTED FOR PRIVACY,"Tech Name: REDACTED FOR PRIVACY|Tech Organization: REDACTED FOR PRIVACY|Tech Street:  REDACTED FOR PRIVACY|Tech City: REDACTED FOR PRIVACY|Tech State/Province: REDACTED FOR PRIVACY|Tech Postal Code: REDACTED FOR PRIVACY|Tech Country: REDACTED FOR PRIVACY|Tech Phone: REDACTED FOR PRIVACY|Tech Phone Ext: REDACTED FOR PRIVACY|Tech Fax: REDACTED FOR PRIVACY|Tech Fax Ext: REDACTED FOR PRIVACY|Tech Email: Please query the RDDS service of the Registrar of Record  identified in this output for information on how to contact the Registrant, Admin, or Tech contact of the queried domain name.",,,,,,,,,,,,,,,,,MASKED_WHOIS_DATA
posinstin.cfd,Gname.com Pte. Ltd.,complaint@gname.com,whois.gname.com,A.SHARE-DNS.COM|B.SHARE-DNS.NET|,2024-04-02T07:06:45.0Z,2024-04-07T07:10:04.0Z,2025-04-02T23:59:59.0Z,2024-04-02 07:06:45 UTC,2024-04-07 07:10:04 UTC,2025-04-02 23:59:59 UTC,serverHold clientTransferProhibited,"Domain Name: POSINSTIN.CFD|Registry Domain ID: D444364452-CNIC|Registrar WHOIS Server: whois.gname.com|Registrar URL: https://www.gname.com/|Updated Date: 2024-04-07T07:10:04.0Z|Creation Date: 2024-04-02T07:06:45.0Z|Registry Expiry Date: 2025-04-02T23:59:59.0Z|Registrar: Gname.com Pte. Ltd.|Registrar IANA ID: 1923|Domain Status: serverHold https://icann.org/epp#serverHold|Domain Status: clientTransferProhibited https://icann.org/epp#clientTransferProhibited|Registrant Organization: wan yi da xin xi ke ji you xian gong si|Registrant State/Province: sdufn|Registrant Country: IL|Registrant Email: Please query the RDDS service of the Registrar of Record identified in this output for information on how to contact the Registrant, Admin, or Tech contact of the queried domain name.|Admin Email: Please query the RDDS service of the Registrar of Record identified in this output for information on how to contact the Registrant, Admin, or Tech contact of the queried domain name.|Tech Email: Please query the RDDS service of the Registrar of Record identified in this output for information on how to contact the Registrant, Admin, or Tech contact of the queried domain name.|Name Server: A.SHARE-DNS.COM|Name Server: B.SHARE-DNS.NET|DNSSEC: unsigned|Billing Email: Please query the RDDS service of the Registrar of Record identified in this output for information on how to contact the Registrant, Admin, or Tech contact of the queried domain name.|Registrar Abuse Contact Email: complaint@gname.com|Registrar Abuse Contact Phone: +65.65189986|URL of the ICANN Whois Inaccuracy Complaint Form: https://www.icann.org/wicf/|>>> Last update of WHOIS database: 2025-01-03T12:52:29.0Z <<<||For more information on Whois status codes, please visit https://icann.org/epp||>>> IMPORTANT INFORMATION ABOUT THE DEPLOYMENT OF RDAP: please visit|https://www.centralnicregistry.com/support/rdap <<<||The Whois and RDAP services are provided by CentralNic, and contain|information pertaining to Internet domain names registered by our|our customers. By using this service you are agreeing (1) not to use any|information presented here for any purpose other than determining|ownership of domain names, (2) not to store or reproduce this data in|any way, (3) not to use any high-volume, automated, electronic processes|to obtain data from this service. Abuse of this service is monitored and|actions in contravention of these terms will result in being permanently|blacklisted. All data is (c) CentralNic Ltd (https://www.centralnicregistry.com)||Access to the Whois and RDAP services is rate limited. For more|information, visit https://registrar-console.centralnicregistry.com/pub/whois_guidance.",,1923,,,wan yi da xin xi ke ji you xian gong si,,,,,,sdufn,,ISRAEL,,,,,"Registrant Organization: wan yi da xin xi ke ji you xian gong si|Registrant State/Province: sdufn|Registrant Country: IL|Registrant Email: Please query the RDDS service of the Registrar of Record identified in this output for information on how to contact the Registrant, Admin, or Tech contact of the queried domain name.",,,,,,,,,,,ISRAEL,,,,,"Admin Email: Please query the RDDS service of the Registrar of Record identified in this output for information on how to contact the Registrant, Admin, or Tech contact of the queried domain name.",,,,,,,,,,,ISRAEL,,,,,"Billing Email: Please query the RDDS service of the Registrar of Record identified in this output for information on how to contact the Registrant, Admin, or Tech contact of the queried domain name.",,,,,,,,,,,ISRAEL,,,,,"Tech Email: Please query the RDDS service of the Registrar of Record identified in this output for information on how to contact the Registrant, Admin, or Tech contact of the queried domain name.",,,,,,,,,,,,,,,,,
pos-me-my.top,"NameSilo, LLC",,whois.nic.top,meilani.ns.cloudflare.com,4/4/2024 0:00,4/4/2024 0:00,4/4/2025 0:00,,,,,"The queried object does not exist: pos-me-my.top|>>> Last update of WHOIS database: 2025-01-03T12:51:14Z <<<||Status Codes: For more information on Whois status codes, please visit https://icann.org/epp||NOTICE: The expiration date displayed in this record is the date the|registrar's sponsorship of the domain name registration in the registry is|currently set to expire. This date does not necessarily reflect the expiration|date of the domain name registrant's agreement with the sponsoring|registrar.  Users may consult the sponsoring registrar's Whois database to|view the registrar's reported date of expiration for this registration.||TERMS OF USE: You are not authorized to access or query our Whois|database through the use of electronic processes that are high-volume and|automated except as reasonably necessary to register domain names or|modify existing registrations; the Data in ZDNS Global Registry|Services' (""ZDNS"") Whois database is provided by ZDNS for|information purposes only, and to assist persons in obtaining information|about or related to a domain name registration record. ZDNS does not|guarantee its accuracy. By submitting a Whois query, you agree to abide|by the following terms of use: You agree that you may use this Data only|for lawful purposes and that under no circumstances will you use this Data|to: (1) allow, enable, or otherwise support the transmission of mass|unsolicited, commercial advertising or solicitations via e-mail, telephone,|or facsimile; or (2) enable high volume, automated, electronic processes|that apply to ZDNS (or its computer systems). The compilation,|repackaging, dissemination or other use of this Data is expressly|prohibited without the prior written consent of ZDNS. You agree not to|use electronic processes that are automated and high-volume to access or|query the Whois database except as reasonably necessary to register|domain names or modify existing registrations. ZDNS reserves the right|to restrict your access to the Whois database in its sole discretion to ensure|operational stability.  ZDNS may restrict or terminate your access to the|Whois database for failure to abide by these terms of use. ZDNS|reserves the right to modify these terms at any time.",,1479,,,,,,,,,,,,,,,,,,,,,,,,,,,,,,,,,,,,,,,,,,,,,,,,,,,,,,,,,,,,,,,,,,,,,,,,,,,,,,,,,MISSING_WHOIS_DATA
