domainName,registrarName,contactEmail,whoisServer,nameServers,createdDate,updatedDate,expiresDate,standardRegCreatedDate,standardRegUpdatedDate,standardRegExpiresDate,status,RegistryData_rawText,WhoisRecord_rawText,registrarIANAID,registrant_email,registrant_name,registrant_organization,registrant_street1,registrant_street2,registrant_street3,registrant_street4,registrant_city,registrant_state,registrant_postalCode,registrant_country,registrant_fax,registrant_faxExt,registrant_telephone,registrant_telephoneExt,registrant_rawText,administrativeContact_email,administrativeContact_name,administrativeContact_organization,administrativeContact_street1,administrativeContact_street2,administrativeContact_street3,administrativeContact_street4,administrativeContact_city,administrativeContact_state,administrativeContact_postalCode,administrativeContact_country,administrativeContact_fax,administrativeContact_faxExt,administrativeContact_telephone,administrativeContact_telephoneExt,administrativeContact_rawText,billingContact_email,billingContact_name,billingContact_organization,billingContact_street1,billingContact_street2,billingContact_street3,billingContact_street4,billingContact_city,billingContact_state,billingContact_postalCode,billingContact_country,billingContact_fax,billingContact_faxExt,billingContact_telephone,billingContact_telephoneExt,billingContact_rawText,technicalContact_email,technicalContact_name,technicalContact_organization,technicalContact_street1,technicalContact_street2,technicalContact_street3,technicalContact_street4,technicalContact_city,technicalContact_state,technicalContact_postalCode,technicalContact_country,technicalContact_fax,technicalContact_faxExt,technicalContact_telephone,technicalContact_telephoneExt,technicalContact_rawText,zoneContact_email,zoneContact_name,zoneContact_organization,zoneContact_street1,zoneContact_street2,zoneContact_street3,zoneContact_street4,zoneContact_city,zoneContact_state,zoneContact_postalCode,zoneContact_country,zoneContact_fax,zoneContact_faxExt,zoneContact_telephone,zoneContact_telephoneExt,zoneContact_rawText,dataFlag
accimbclicksses.help,"NameSilo, LLC",abuse@namesilo.com,whois.namesilo.com,ALFRED.NS.CLOUDFLARE.COM|HEIDI.NS.CLOUDFLARE.COM|,2024-12-12T11:28:32.0Z,2024-12-27T11:46:34.0Z,2025-12-12T23:59:59.0Z,2024-12-12 11:28:32 UTC,2024-12-27 11:46:34 UTC,2025-12-12 23:59:59 UTC,serverTransferProhibited clientHold clientTransferProhibited,"Domain Name: ACCIMBCLICKSSES.HELP|Registry Domain ID: D511000488-CNIC|Registrar WHOIS Server: whois.namesilo.com|Registrar URL: https://www.namesilo.com|Updated Date: 2024-12-27T11:46:34.0Z|Creation Date: 2024-12-12T11:28:32.0Z|Registry Expiry Date: 2025-12-12T23:59:59.0Z|Registrar: NameSilo, LLC|Registrar IANA ID: 1479|Domain Status: serverTransferProhibited https://icann.org/epp#serverTransferProhibited|Domain Status: clientHold https://icann.org/epp#clientHold|Domain Status: clientTransferProhibited https://icann.org/epp#clientTransferProhibited|Registrant Organization: See PrivacyGuardian.org|Registrant State/Province: AZ|Registrant Country: US|Registrant Email: Please query the RDDS service of the Registrar of Record identified in this output for information on how to contact the Registrant, Admin, or Tech contact of the queried domain name.|Admin Email: Please query the RDDS service of the Registrar of Record identified in this output for information on how to contact the Registrant, Admin, or Tech contact of the queried domain name.|Tech Email: Please query the RDDS service of the Registrar of Record identified in this output for information on how to contact the Registrant, Admin, or Tech contact of the queried domain name.|Name Server: ALFRED.NS.CLOUDFLARE.COM|Name Server: HEIDI.NS.CLOUDFLARE.COM|DNSSEC: unsigned|Billing Email: Please query the RDDS service of the Registrar of Record identified in this output for information on how to contact the Registrant, Admin, or Tech contact of the queried domain name.|Registrar Abuse Contact Email: abuse@namesilo.com|Registrar Abuse Contact Phone: +1.4805240066|URL of the ICANN Whois Inaccuracy Complaint Form: https://www.icann.org/wicf/|>>> Last update of WHOIS database: 2025-01-03T12:52:29.0Z <<<||For more information on Whois status codes, please visit https://icann.org/epp||>>> IMPORTANT INFORMATION ABOUT THE DEPLOYMENT OF RDAP: please visit|https://www.centralnicregistry.com/support/rdap <<<||The Whois and RDAP services are provided by CentralNic, and contain|information pertaining to Internet domain names registered by our|our customers. By using this service you are agreeing (1) not to use any|information presented here for any purpose other than determining|ownership of domain names, (2) not to store or reproduce this data in|any way, (3) not to use any high-volume, automated, electronic processes|to obtain data from this service. Abuse of this service is monitored and|actions in contravention of these terms will result in being permanently|blacklisted. All data is (c) CentralNic Ltd (https://www.centralnicregistry.com)||Access to the Whois and RDAP services is rate limited. For more|information, visit https://registrar-console.centralnicregistry.com/pub/whois_guidance.",,1479,,,See PrivacyGuardian.org,,,,,,AZ,,UNITED STATES,,,,,"Registrant Organization: See PrivacyGuardian.org|Registrant State/Province: AZ|Registrant Country: US|Registrant Email: Please query the RDDS service of the Registrar of Record identified in this output for information on how to contact the Registrant, Admin, or Tech contact of the queried domain name.",,,,,,,,,,,UNITED STATES,,,,,"Admin Email: Please query the RDDS service of the Registrar of Record identified in this output for information on how to contact the Registrant, Admin, or Tech contact of the queried domain name.",,,,,,,,,,,UNITED STATES,,,,,"Billing Email: Please query the RDDS service of the Registrar of Record identified in this output for information on how to contact the Registrant, Admin, or Tech contact of the queried domain name.",,,,,,,,,,,UNITED STATES,,,,,"Tech Email: Please query the RDDS service of the Registrar of Record identified in this output for information on how to contact the Registrant, Admin, or Tech contact of the queried domain name.",,,,,,,,,,,,,,,,,
accimbclicxs.xyz,"NameSilo, LLC",abuse@namesilo.com,whois.namesilo.com,ALFRED.NS.CLOUDFLARE.COM|HEIDI.NS.CLOUDFLARE.COM|,2024-12-12T11:28:32.0Z,2024-12-19T16:12:13.0Z,2025-12-12T23:59:59.0Z,2024-12-12 11:28:32 UTC,2024-12-19 16:12:13 UTC,2025-12-12 23:59:59 UTC,serverTransferProhibited clientHold clientTransferProhibited,"Domain Name: ACCIMBCLICXS.XYZ|Registry Domain ID: D511000494-CNIC|Registrar WHOIS Server: whois.namesilo.com|Registrar URL: https://www.namesilo.com|Updated Date: 2024-12-19T16:12:13.0Z|Creation Date: 2024-12-12T11:28:32.0Z|Registry Expiry Date: 2025-12-12T23:59:59.0Z|Registrar: NameSilo, LLC|Registrar IANA ID: 1479|Domain Status: serverTransferProhibited https://icann.org/epp#serverTransferProhibited|Domain Status: clientHold https://icann.org/epp#clientHold|Domain Status: clientTransferProhibited https://icann.org/epp#clientTransferProhibited|Registrant Organization: See PrivacyGuardian.org|Registrant State/Province: AZ|Registrant Country: US|Registrant Email: Please query the RDDS service of the Registrar of Record identified in this output for information on how to contact the Registrant, Admin, or Tech contact of the queried domain name.|Admin Email: Please query the RDDS service of the Registrar of Record identified in this output for information on how to contact the Registrant, Admin, or Tech contact of the queried domain name.|Tech Email: Please query the RDDS service of the Registrar of Record identified in this output for information on how to contact the Registrant, Admin, or Tech contact of the queried domain name.|Name Server: ALFRED.NS.CLOUDFLARE.COM|Name Server: HEIDI.NS.CLOUDFLARE.COM|DNSSEC: unsigned|Billing Email: Please query the RDDS service of the Registrar of Record identified in this output for information on how to contact the Registrant, Admin, or Tech contact of the queried domain name.|Registrar Abuse Contact Email: abuse@namesilo.com|Registrar Abuse Contact Phone: +1.4805240066|URL of the ICANN Whois Inaccuracy Complaint Form: https://www.icann.org/wicf/|>>> Last update of WHOIS database: 2024-12-20T11:41:16.0Z <<<||For more information on Whois status codes, please visit https://icann.org/epp||>>> IMPORTANT INFORMATION ABOUT THE DEPLOYMENT OF RDAP: please visit|https://www.centralnicregistry.com/support/rdap <<<||The Whois and RDAP services are provided by CentralNic, and contain|information pertaining to Internet domain names registered by our|our customers. By using this service you are agreeing (1) not to use any|information presented here for any purpose other than determining|ownership of domain names, (2) not to store or reproduce this data in|any way, (3) not to use any high-volume, automated, electronic processes|to obtain data from this service. Abuse of this service is monitored and|actions in contravention of these terms will result in being permanently|blacklisted. All data is (c) CentralNic Ltd (https://www.centralnicregistry.com)||Access to the Whois and RDAP services is rate limited. For more|information, visit https://registrar-console.centralnicregistry.com/pub/whois_guidance.",,1479,,,See PrivacyGuardian.org,,,,,,AZ,,UNITED STATES,,,,,"Registrant Organization: See PrivacyGuardian.org|Registrant State/Province: AZ|Registrant Country: US|Registrant Email: Please query the RDDS service of the Registrar of Record identified in this output for information on how to contact the Registrant, Admin, or Tech contact of the queried domain name.",,,,,,,,,,,UNITED STATES,,,,,"Admin Email: Please query the RDDS service of the Registrar of Record identified in this output for information on how to contact the Registrant, Admin, or Tech contact of the queried domain name.",,,,,,,,,,,UNITED STATES,,,,,"Billing Email: Please query the RDDS service of the Registrar of Record identified in this output for information on how to contact the Registrant, Admin, or Tech contact of the queried domain name.",,,,,,,,,,,UNITED STATES,,,,,"Tech Email: Please query the RDDS service of the Registrar of Record identified in this output for information on how to contact the Registrant, Admin, or Tech contact of the queried domain name.",,,,,,,,,,,,,,,,,
acimbclilx.link,"NameSilo, LLC",abuse@namesilo.com,whois.namesilo.com,brenna.ns.cloudflare.com|arvind.ns.cloudflare.com|,2024-12-26T15:30:56.465Z,2024-12-31T15:31:04.686Z,2025-12-26T15:30:56.465Z,2024-12-26 15:30:56 UTC,2024-12-31 15:31:04 UTC,2025-12-26 15:30:56 UTC,clientTransferProhibited,"Domain Name: acimbclilx.link|Registry Domain ID: DO_1ca0d458270aa1ea64f1f3376ded5270-UR|Registrar WHOIS Server: whois.namesilo.com|Registrar URL: www.namesilo.com|Updated Date: 2024-12-31T15:31:04.686Z|Creation Date: 2024-12-26T15:30:56.465Z|Registry Expiry Date: 2025-12-26T15:30:56.465Z|Registrar: NameSilo, LLC|Registrar IANA ID: 1479|Registrar Abuse Contact Email: abuse@namesilo.com|Registrar Abuse Contact Phone: +1.4805240066|Domain Status: clientTransferProhibited https://icann.org/epp#clientTransferProhibited|Registry Registrant ID: REDACTED FOR PRIVACY|Registrant Name: REDACTED FOR PRIVACY|Registrant Organization: See PrivacyGuardian.org|Registrant Street: REDACTED FOR PRIVACY|Registrant City: REDACTED FOR PRIVACY|Registrant State/Province: AZ|Registrant Postal Code: REDACTED FOR PRIVACY|Registrant Country: US|Registrant Phone: REDACTED FOR PRIVACY|Registrant Fax: REDACTED FOR PRIVACY|Registrant Email: Please query the RDDS service of the Registrar of Record identified in this output for information on how to contact the Registrant, Admin, or Tech contact of the queried domain name.|Registry Admin ID: REDACTED FOR PRIVACY|Admin Name: REDACTED FOR PRIVACY|Admin Organization: REDACTED FOR PRIVACY|Admin Street: REDACTED FOR PRIVACY|Admin City: REDACTED FOR PRIVACY|Admin State/Province: REDACTED FOR PRIVACY|Admin Postal Code: REDACTED FOR PRIVACY|Admin Country: REDACTED FOR PRIVACY|Admin Phone: REDACTED FOR PRIVACY|Admin Fax: REDACTED FOR PRIVACY|Admin Email: Please query the RDDS service of the Registrar of Record identified in this output for information on how to contact the Registrant, Admin, or Tech contact of the queried domain name.|Registry Tech ID: REDACTED FOR PRIVACY|Tech Name: REDACTED FOR PRIVACY|Tech Organization: REDACTED FOR PRIVACY|Tech Street: REDACTED FOR PRIVACY|Tech City: REDACTED FOR PRIVACY|Tech State/Province: REDACTED FOR PRIVACY|Tech Postal Code: REDACTED FOR PRIVACY|Tech Country: REDACTED FOR PRIVACY|Tech Phone: REDACTED FOR PRIVACY|Tech Fax: REDACTED FOR PRIVACY|Tech Email: Please query the RDDS service of the Registrar of Record identified in this output for information on how to contact the Registrant, Admin, or Tech contact of the queried domain name.|Registry Billing ID: REDACTED FOR PRIVACY|Billing Name: REDACTED FOR PRIVACY|Billing Organization: REDACTED FOR PRIVACY|Billing Street: REDACTED FOR PRIVACY|Billing City: REDACTED FOR PRIVACY|Billing State/Province: REDACTED FOR PRIVACY|Billing Postal Code: REDACTED FOR PRIVACY|Billing Country: REDACTED FOR PRIVACY|Billing Phone: REDACTED FOR PRIVACY|Billing Fax: REDACTED FOR PRIVACY|Billing Email: Please query the RDDS service of the Registrar of Record identified in this output for information on how to contact the Registrant, Admin, or Tech contact of the queried domain name.|Name Server: brenna.ns.cloudflare.com|Name Server: arvind.ns.cloudflare.com|DNSSEC: unsigned|URL of the ICANN RDDS Inaccuracy Complaint Form: https://www.icann.org/wicf/||>>> Last update of WHOIS database: 2025-01-03T12:52:28.953Z <<<||For more information on domain status codes, please visit https://icann.org/epp||The WHOIS information provided in this page has been redacted|in compliance with ICANN's Temporary Specification for gTLD|Registration Data.||The data in this record is provided by Uniregistry for informational|purposes only, and it does not guarantee its accuracy. Uniregistry is|authoritative for whois information in top-level domains it operates|under contract with the Internet Corporation for Assigned Names and|Numbers. Whois information from other top-level domains is provided by|a third-party under license to Uniregistry.||This service is intended only for query-based access. By using this|service, you agree that you will use any data presented only for lawful|purposes and that, under no circumstances will you use (a) data|acquired for the purpose of allowing, enabling, or otherwise supporting|the transmission by e-mail, telephone, facsimile or other|communications mechanism of mass  unsolicited, commercial advertising|or solicitations to entities other than your existing  customers; or|(b) this service to enable high volume, automated, electronic processes|that send queries or data to the systems of any Registrar or any|Registry except as reasonably necessary to register domain names or|modify existing domain name registrations.||Uniregistry reserves the right to modify these terms at any time. By|submitting this query, you agree to abide by this policy. All rights|reserved.",,1479,,REDACTED FOR PRIVACY,See PrivacyGuardian.org,REDACTED FOR PRIVACY,,,,REDACTED FOR PRIVACY,AZ,REDACTED FOR PRIVACY,UNITED STATES,,,,,"Registrant Name: REDACTED FOR PRIVACY|Registrant Organization: See PrivacyGuardian.org|Registrant Street: REDACTED FOR PRIVACY|Registrant City: REDACTED FOR PRIVACY|Registrant State/Province: AZ|Registrant Postal Code: REDACTED FOR PRIVACY|Registrant Country: US|Registrant Phone: REDACTED FOR PRIVACY|Registrant Fax: REDACTED FOR PRIVACY|Registrant Email: Please query the RDDS service of the Registrar of Record identified in this output for information on how to contact the Registrant, Admin, or Tech contact of the queried domain name.",,REDACTED FOR PRIVACY,REDACTED FOR PRIVACY,REDACTED FOR PRIVACY,,,,REDACTED FOR PRIVACY,REDACTED FOR PRIVACY,REDACTED FOR PRIVACY,REDACTED FOR PRIVACY,,,,,"Admin Name: REDACTED FOR PRIVACY|Admin Organization: REDACTED FOR PRIVACY|Admin Street: REDACTED FOR PRIVACY|Admin City: REDACTED FOR PRIVACY|Admin State/Province: REDACTED FOR PRIVACY|Admin Postal Code: REDACTED FOR PRIVACY|Admin Country: REDACTED FOR PRIVACY|Admin Phone: REDACTED FOR PRIVACY|Admin Fax: REDACTED FOR PRIVACY|Admin Email: Please query the RDDS service of the Registrar of Record identified in this output for information on how to contact the Registrant, Admin, or Tech contact of the queried domain name.",,REDACTED FOR PRIVACY,REDACTED FOR PRIVACY,REDACTED FOR PRIVACY,,,,REDACTED FOR PRIVACY,REDACTED FOR PRIVACY,REDACTED FOR PRIVACY,REDACTED FOR PRIVACY,,,,,"Billing Name: REDACTED FOR PRIVACY|Billing Organization: REDACTED FOR PRIVACY|Billing Street: REDACTED FOR PRIVACY|Billing City: REDACTED FOR PRIVACY|Billing State/Province: REDACTED FOR PRIVACY|Billing Postal Code: REDACTED FOR PRIVACY|Billing Country: REDACTED FOR PRIVACY|Billing Phone: REDACTED FOR PRIVACY|Billing Fax: REDACTED FOR PRIVACY|Billing Email: Please query the RDDS service of the Registrar of Record identified in this output for information on how to contact the Registrant, Admin, or Tech contact of the queried domain name.",,REDACTED FOR PRIVACY,REDACTED FOR PRIVACY,REDACTED FOR PRIVACY,,,,REDACTED FOR PRIVACY,REDACTED FOR PRIVACY,REDACTED FOR PRIVACY,REDACTED FOR PRIVACY,,,,,"Tech Name: REDACTED FOR PRIVACY|Tech Organization: REDACTED FOR PRIVACY|Tech Street: REDACTED FOR PRIVACY|Tech City: REDACTED FOR PRIVACY|Tech State/Province: REDACTED FOR PRIVACY|Tech Postal Code: REDACTED FOR PRIVACY|Tech Country: REDACTED FOR PRIVACY|Tech Phone: REDACTED FOR PRIVACY|Tech Fax: REDACTED FOR PRIVACY|Tech Email: Please query the RDDS service of the Registrar of Record identified in this output for information on how to contact the Registrant, Admin, or Tech contact of the queried domain name.",,,,,,,,,,,,,,,,,MASKED_WHOIS_DATA
ceclcomr.us,"NameSilo, LLC",grsfhiyrschuyds@gmail.com,whois.namesilo.com,ns1.dnsowl.com|ns3.dnsowl.com|ns2.dnsowl.com|,2024-12-11T07:00:50Z,2024-12-16T07:00:50Z,2025-12-11T07:00:50Z,2024-12-11 07:00:50 UTC,2024-12-16 07:00:50 UTC,2025-12-11 07:00:50 UTC,clientTransferProhibited serverTransferProhibited,"Domain Name: ceclcomr.us|Registry Domain ID: D9362308C697E48C89A066DDB0D8C5EA7-GDREG|Registrar WHOIS Server: whois.namesilo.com|Registrar URL: www.namesilo.com|Updated Date: 2024-12-16T07:00:50Z|Creation Date: 2024-12-11T07:00:50Z|Registry Expiry Date: 2025-12-11T07:00:50Z|Registrar: NameSilo, LLC|Registrar IANA ID: 1479|Registrar Abuse Contact Email: abuse@namesilo.com|Registrar Abuse Contact Phone: +1.4805240066|Domain Status: clientTransferProhibited https://icann.org/epp#clientTransferProhibited|Domain Status: serverTransferProhibited https://icann.org/epp#serverTransferProhibited|Registry Registrant ID: C22F7F57DFE154ED081A65AB00196ABB6-GDREG|Registrant Name: Alfred Roberts|Registrant Organization:|Registrant Street: 1198 Newton Street, Minneapolis, Minnesota 55401|Registrant Street:|Registrant Street:|Registrant City: Minnesota|Registrant State/Province: MN|Registrant Postal Code: 55401|Registrant Country: US|Registrant Phone: +1.3203063535|Registrant Phone Ext:|Registrant Fax:|Registrant Fax Ext:|Registrant Email: grsfhiyrschuyds@gmail.com|Registrant Application Purpose: P3|Registrant Nexus Category: C11|Registry Admin ID: C22F7F57DFE154ED081A65AB00196ABB6-GDREG|Admin Name: Alfred Roberts|Admin Organization:|Admin Street: 1198 Newton Street, Minneapolis, Minnesota 55401|Admin Street:|Admin Street:|Admin City: Minnesota|Admin State/Province: MN|Admin Postal Code: 55401|Admin Country: US|Admin Phone: +1.3203063535|Admin Phone Ext:|Admin Fax:|Admin Fax Ext:|Admin Email: grsfhiyrschuyds@gmail.com|Admin Application Purpose: P3|Admin Nexus Category: C11|Registry Tech ID: C22F7F57DFE154ED081A65AB00196ABB6-GDREG|Tech Name: Alfred Roberts|Tech Organization:|Tech Street: 1198 Newton Street, Minneapolis, Minnesota 55401|Tech Street:|Tech Street:|Tech City: Minnesota|Tech State/Province: MN|Tech Postal Code: 55401|Tech Country: US|Tech Phone: +1.3203063535|Tech Phone Ext:|Tech Fax:|Tech Fax Ext:|Tech Email: grsfhiyrschuyds@gmail.com|Tech Application Purpose: P3|Tech Nexus Category: C11|Name Server: ns1.dnsowl.com|Name Server: ns3.dnsowl.com|Name Server: ns2.dnsowl.com|DNSSEC: unsigned|URL of the ICANN Whois Inaccuracy Complaint Form: https://www.icann.org/wicf/|>>> Last update of WHOIS database: 2025-01-03T12:52:29Z <<<||For more information on Whois status codes, please visit https://icann.org/epp||.US WHOIS Complaint Tool - http://www.whoiscomplaints.us|Advanced WHOIS Instructions - http://whois.us/help.html||Registry Services, LLC, the Registry Administrator for .US, has collected this information for the WHOIS database through a .US-Accredited Registrar. This information is provided to you for informational purposes only and is designed to assist persons in determining contents of a domain name registration record in the registry database. ||Registry Services, LLC makes this information available to you ""as is"" and does not guarantee its accuracy. By submitting a WHOIS query, you agree that you will use this data only for lawful purposes and that, under no circumstances will you use this data: ||(1) to allow, enable, or otherwise support the transmission of mass unsolicited, commercial advertising or solicitations via direct mail, electronic mail, or by telephone; |(2) in contravention of any applicable data and privacy protection laws; or |(3) to enable high volume, automated, electronic processes that apply to the registry (or its systems). ||Compilation, repackaging, dissemination, or other use of the WHOIS database in its entirety, or of a substantial portion thereof, is not allowed without our prior written permission. ||We reserve the right to modify or change these conditions at any time without prior or subsequent notification of any kind. By executing this query, in any manner whatsoever, you agree to abide by these terms. NOTE: FAILURE TO LOCATE A RECORD IN THE WHOIS DATABASE IS NOT INDICATIVE OF THE AVAILABILITY OF A DOMAIN NAME. All domain names are subject to certain additional domain name registration rules. For details, please visit our site at www.whois.us.",,1479,grsfhiyrschuyds@gmail.com,Alfred Roberts,,"1198 Newton Street, Minneapolis, Minnesota 55401",,,,Minnesota,MN,55401,UNITED STATES,,,13203063535,,"Registrant Name: Alfred Roberts|Registrant Street: 1198 Newton Street, Minneapolis, Minnesota 55401|Registrant City: Minnesota|Registrant State/Province: MN|Registrant Postal Code: 55401|Registrant Country: US|Registrant Phone: +1.3203063535|Registrant Email: grsfhiyrschuyds@gmail.com",grsfhiyrschuyds@gmail.com,Alfred Roberts,,"1198 Newton Street, Minneapolis, Minnesota 55401",,,,Minnesota,MN,55401,UNITED STATES,,,13203063535,,"Admin Name: Alfred Roberts|Admin Street: 1198 Newton Street, Minneapolis, Minnesota 55401|Admin City: Minnesota|Admin State/Province: MN|Admin Postal Code: 55401|Admin Country: US|Admin Phone: +1.3203063535|Admin Email: grsfhiyrschuyds@gmail.com",,,,,,,,,,,,,,,,,grsfhiyrschuyds@gmail.com,Alfred Roberts,,"1198 Newton Street, Minneapolis, Minnesota 55401",,,,Minnesota,MN,55401,UNITED STATES,,,13203063535,,"Tech Name: Alfred Roberts|Tech Street: 1198 Newton Street, Minneapolis, Minnesota 55401|Tech City: Minnesota|Tech State/Province: MN|Tech Postal Code: 55401|Tech Country: US|Tech Phone: +1.3203063535|Tech Email: grsfhiyrschuyds@gmail.com",,,,,,,,,,,,,,,,,
